REPORTER	TITRE	AUTEUR	CHAPO	TEXTE	REF	PHOTO
David-Néel, Alexandra	Alexandra David-Néel, aventurière complètement à l’Est	Clotilde Dumay	Anarchiste, féministe, bouddhiste, écrivaine, journaliste, Alexandra David-Néel est aussi une exploratrice ayant surtout voyagé en Orient. Elle est la première européenne à avoir séjourné à Lhassa, ville interdite, au Tibet. Une expérience qu’elle relate dans les journaux de l’époque et qui contribue fortement à sa célébrité. 	Louise Eugénie Alexandrine Marie David, plus connue sous le nom d’Alexandra David-Néel est née le 24 octobre 1868 à Saint-Mandé (Val-de-Marne) et s’est éteinte le 8 septembre 1969, à Digne-les-Bains (Alpes-de-Haute-Provence). Son père, Louis David, est un instituteur français et un franc-maçon. Sa mère, Alexandrine Borghmans, est une Belge catholique. En 1873, la famille s’expatrie en Belgique, ce qui ne plaît guère à la jeune fille unique : « Bruxelles est presque ma patrie, se remémore-t-elle en 1937, dans l’ouvrage Sous des nuées d’orage. Petite Parisienne de moins de six ans, j’y suis arrivée toute hérissée de méfiance et de dédain, bien résolue, à bouder cette capitale infime. De plusieurs années, je ne désarmai pas. Les splendeurs de ma ville me hantaient. » Le goût pour le voyage la saisit rapidement : dès ses 15 ans, elle fugue vers l’Angleterre. Deux ans plus tard, elle s’enfuit de nouveau, en direction de la Suisse et de l’Italie[1], cette fois.<br>Durant son enfance et son adolescence, Alexandra David-Néel fréquente Élisée Reclus, un géographe libertaire belge qui l’amène à s’intéresser aux idées anarchistes et féministes de l’époque. Dans son premier livre, Pour la vie, elle attaque ainsi les religions, la patrie, la propriété ou encore la conscience. Elle contribue également à La Fronde, un journal féministe géré de manière coopérative par des femmes. Mais préfère lutter pour l’émancipation économique que pour le droit de vote, et s’éloigne donc progressivement de certaines positions de l’époque[2]. En 1888, la jeune femme entre dans la franc-maçonnerie puis elle se convertie au bouddhisme. Après avoir passé un an à Londres pour perfectionner son anglais, Alexandra David-Néel revient à Paris et s’intéresse aux philosophies orientales. Elle pense même devenir orientaliste après avoir visité le musée Guimet[3].<br>À la fin du XIXe siècle, incitée par son père, elle entre au Conservatoire royal de Bruxelles, où elle étudie le piano et le chant. Par la suite, elle occupe l’emploi de première chanteuse à l’opéra d’Hanoï (Indochine). Alors qu’elle partage la vie du pianiste Jean Haustont, à Paris, elle part chanter à l’opéra d’Athènes puis à celui de Tunis. Là-bas, elle rencontre l’ingénieur en chef des Chemins de fer tunisiens, Philippe Néel, qu’elle épouse en 1904, avec l’approbation de son père. « Jusqu’à ce jour, ma fille avait manifesté sa ferme volonté de ne jamais aliéner sa liberté et elle protestait à chaque instant contre l’état d’infériorité que la loi impose à la femme dans tous les actes de sa vie après son mariage, écrit-il alors à son beau-fils. Aujourd’hui votre demande me ferait croire qu’elle a fortement modifié ses idées. S’il en est ainsi, Monsieur, je ne vois pas de raison pour vous refuser mon consentement. »[4]<br>Mais son amour pour l’Orient et le voyage la rattrape : en 1911, Alexandra David-Néel annonce à son mari qu’elle part en Inde pour 18 mois. Elle y reste finalement 14 ans, tout en entretenant une correspondance avec son époux[5]. En 1912, elle arrive au Sikkim (État situé dans l’Himalaya) et visite de nombreux monastères bouddhistes. En 1914, elle rencontre le jeune Aphur Yongden, qui deviendra son fils adoptif et avec qui elle se retire dans une caverne à plus de 4 000 mètres d’altitude[6]. Peu après, elle est reçue en audience par le 13e dalaï-lama. En 1916, Alexandra David-Néel et Aphur Yongden partent pour le Tibet. Puis passent en Inde, au Japon, en Corée et en Chine.<br>En 1924, elle entame un séjour qui la rendra célèbre à son retour. Elle et Aphur Yongden, déguisés en mendiante et en moine, arrivent à Lhassa, ville sainte alors interdite aux explorateurs européens[7]. « J'y suis allée parce que la ville se trouvait sur ma route et aussi parce que c'était une plaisanterie très parisienne à faire à ceux qui en interdisent l'entrée », explique-t-elle dans une lettre adressée à son mari. Elle y reste deux mois et visite la ville ainsi que les monastères environnants.<br>De retour en France, Alexandra David-Néel adopte légalement Aphur Yongden et publie ses aventures dans le journal Le Matin, qui se réjouit de partager « le fantastique voyage de […] cette Parisienne qui, toute seule, a exploré les régions les plus mystérieuses du Tibet »[8]. Elle relate également son expérience dans l’ouvrage Voyage d’une Parisienne à Lhassa (1927), donne des conférences et s’installe à Digne-les-Bains.<br>À l’âge de 69 ans, elle repart en Chine avec son fils adoptif. Ils découvrent alors les ravages de la guerre sino-japonaise. Leur séjour durera neuf ans. « Je crois que cela m’a toujours été et me serait, plus que jamais, pénible de demeurer quelque part, déclare-t-elle un jour. Drôle et inconcevable idée qu’ont les gens de s’attacher à un endroit comme des huîtres à leurs bancs, quand il y a tant à voir de par le vaste monde et tant d’horizons à savourer. »[9]<br>En 1941, Alexandra David-Néel apprend la mort de son mari. Cinq ans plus tard, elle rentre en France avec Aphur Yongden, qui mourra en 1955. Alors qu’elle prépare un tour du monde en 4cv avec la jeune femme qui veille désormais sur elle et qui lui sert de secrétaire, Alexandra David-Néel s’éteint en 1969, à presque 101 ans.  v	[1] SQUILLACE Sophie, Le fabuleux destin d’Alexandra David-Néel, TV5 Monde, publié le 11 mai 2017, consulté le 30 décembre 2017, http://voyage.tv5monde.com/fr/le-fabuleux-destin-dalexandra-david-neel.<br>[2] Alexandra David-Néel, exploratrice infatigable, L’Histoire par les femmes, consulté le 30 décembre 2017, https://histoireparlesfemmes.com/2014/10/02/alexandra-david-neel-exploratrice-infatigable/<br>[3]  SQUILLACE Sophie, Le fabuleux destin d’Alexandra David-Néel, Ibid.<br>[4]  POLLA Barbara, Femmes hors normes, Odile Jacob, 2017, 240 p. À consulter sur internet : http://bit.ly/2GI3a6b<br>[5]  Alexandra David-Néel, exploratrice infatigable, L’Histoire par les femmes, Ibid.<br>[6]  Alexandra David-Néel, Babelio, consulté le 30 décembre 2017, https://www.babelio.com/auteur/Alexandra-David-Neel/8926<br>[7]  Lhassa, Imago Mundi, consulté le 30 décembre 2017, http://www.cosmovisions.com/monuLhassa.htm<br>[8]  DAVID-NÉEL Alexandra, « Souvenirs d’une Parisienne au Thibet », in Le Matin, 21 juin 1925, p. 1. À consulter sur internet : https://www.retronews.fr/journal/le-matin/21-juin-1925/66/147393/1<br>[9] SQUILLACE Sophie, Le fabuleux destin d’Alexandra David-Néel, Ibid.	https://upload.wikimedia.org/wikipedia/commons/8/8c/Alexandra_David-Neels.jpg
Delarue-Mardrus, Lucie	Lucie Delarue-Mardrus, mondaine moderne	Clotilde Dumay	Romancière, poétesse, artiste, journaliste, Lucie Delarue-Mardrus a publié de nombreux écrits dans les quotidiens de l’époque. Voyageuse faisant partie de la mondanité parisienne, elle ne s’interdit pas de critiquer la société à laquelle elle appartient et évoque également la féminité et la mode. Dans ses productions, elle met souvent à l’honneur la Normandie, sa région natale.	"Lucie Delarue-Mardrus est née à Honfleur (Calvados), le 3 novembre 1874 et s’est éteinte à Château-Gontier (Mayenne), le 26 avril 1945. Fille d’un avocat et d’une mère au foyer, elle est la dernière d’une famille de six enfants. Comme ses cinq autres sœurs, elle est élevée selon une éducation bourgeoise, apprend la musique et l’anglais. Sa famille déménage à Paris en 1880. Lucie Delarue-Mardrus se plaît à la capitale et se découvre rapidement une passion pour la poésie et le théâtre.[1] Ses parents refusent de donner la main de leur fille cadette au maréchal Pétain. Elle épouse donc, en 1900, l’orientaliste Joseph-Charles Mardrus, traducteur des Mille et une nuits.<br>Avec lui, elle voyage en Afrique du Nord (Tunisie, Algérie, Maroc, Kroumirie, Égypte, Syrie), mais aussi en Turquie et en Italie. Elle raconte ensuite ses séjours dans des journaux, comme c’est le cas dans Gil Blas, au début du XXe siècle. Et se plaît à décrire la vie quotidienne et les quartiers des villes dans lesquelles elles passent. « C’est là, dans l’indéchiffrable complication des rues crépies, dans les souks sombres, sur les places aux beaux noms, que l’Islam pâle de jeûne attend le coucher du soleil », écrit-elle, par exemple, lorsqu’elle raconte le ramadan à Tunis.[2] Celle que son mari surnomme « princesse Amande » gagne en popularité à Paris, se montre aux soirées mondaines et devient l’amante de plusieurs femmes, notamment de Natalie Barney.[3] En 1908, elle écrit son premier roman, Marie, fille-mère. Mais en même temps que la Première Guerre mondiale éclate, une période difficile de la vie de Lucie Delarue-Mardrus commence.<br>En 1910, son père décède, suivi de sa mère en 1917. Au commencement de la guerre, en 1914, elle est infirmière dans un hôpital à Honfleur. Peu de temps après, « princesse Amande » se sépare de son mari. Elle doit alors vivre de sa plume et rédige des contes et des feuilletons, en particulier pour Le Journal et L’Intransigeant. À l’époque, la jeune femme rencontre Valentine Ovize, qui l’aidera à surmonter cette mauvaise passe, puis qu’elle quittera au profit de Germaine de Castro.[4] En 1922, elle publie L’Ex-voto, l’un de ses plus fameux romans, dans lequel elle rend hommage au quotidien honfleurais. Elle continue de voyager, sculpte, publie des romans et des essais biographiques, donne des conférences.<br>Les articles qu’elle écrit relatent ses séjours, évoquent la mode et la féminité, mais aussi certaines critiques qu’elle émet parfois vis-à-vis de la bourgeoisie de l’époque – à laquelle elle appartient pourtant. « On emballe d’une part les robes, les manteaux, les chapeaux, les costumes de bain ; de l’autre, les maillots, les smokings, les casaques bleues et les bibis blancs. Et en route pour une nouvelle série de représentations, exhibitions, cancans et séances autour des tapis verts », fustige-t-elle par exemple, dans Le Journal, en contant la fin des vacances d’été de la haute société.[5]<br>Mais les difficultés financières s’aggravent et Lucie Delarue-Mardrus souffre de rhumatismes. Cela ne l’empêche toutefois pas de continuer à écrire des articles : les deux derniers sujets importants qu’elle traite, notamment pour Le Journal, concernent un séjour à New York et un concours hippique au Grand Palais. En 1937, elle s’installe à Château-Gontier mais vend sa maison lorsque la Seconde Guerre mondiale commence. Elle part alors vivre chez Germaine de Castro mais meurt en 1945, à l’âge de 70 ans. Artiste prolifique et polymorphe, Lucie Delarue-Mardrus a produit 11 recueils de poésie, au moins 47 romans et nouvelles, trois essais, cinq biographies, quatre récits de voyage, une autobiographie, mais aussi des sculptures et des partitions.[6]"	[1]  Association des Amis de Lucie Delarue-Mardrus, consulté le 30 décembre 2017, https://www.amisldm.org/biographie/<br>[2]  DELARUE-MARDRUS Lucie, « Ramadan », in Gil Blas, 3 février 1905, p. 1. À consulter sur internet : https://www.retronews.fr/journal/gil-blas/03-fevrier-1905/121/257865/1<br>[3]  Association des Amis de Lucie Delarue-Mardrus, consulté le 30 décembre 2017, https://www.amisldm.org/biographie/<br>[4]  Association des Amis de Lucie Delarue-Mardrus, consulté le 30 décembre 2017, https://www.amisldm.org/biographie/<br>[5]  DELARUE-MARDRUS Lucie, « Le billet de la Parisienne », in Le Journal, 5 septembre 1928, p. 5. À consulter sur internet : https://www.retronews.fr/journal/le-journal/05-septembre-1928/129/112225/5<br>[6]  Association des Amis de Lucie Delarue-Mardrus, consulté le 30 décembre 2017, https://www.amisldm.org/biographie/	https://gallica.bnf.fr/ark:/12148/btv1b53120407r/f1.highres
Helsey, Edouard	Edouard Helsey, une vie dédiée au grand reportage	Céline Legay et Lysandra Chadefaux	Véritable pionnier du journalisme moderne, Édouard Helsey s’est distingué par ses nombreux reportages à travers le monde. Journaliste pendant plus de trente ans au Journal, ses écrits ont marqué l’histoire du grand reportage français. Biographie d’un reporter aujourd’hui tombé dans l’oubli. 	« Je m'appelle Lucien Coulond. J'ai pris mes deux initiales pour en faire Helsey. Mais un scrupule grammatical m'empêcha de signer Lucien Helsey. » En trois phrases, Lucien-Edmond Coulond, pour son nom complet, revient sur le choix de son pseudonyme dans ses mémoires de grand reporter nommées Envoyé spécial en 1955. Pourtant tout semblait prédestiner Lucien Coulond alias Edouard Helsey à une carrière orientée vers la création théâtrale. Né en 1883 (Paris) et décédé en 1966 (Paris), Edouard va consacrer sa vie au grand reportage.<br>Il débute à 24 ans une carrière de journaliste littéraire dans le Gil Blas. Journal littéraire et mondain parisien, il y rédige des critiques littéraires. Ce travail n’est pas un choix mais un moyen de subvenir à ses besoins. En parallèle, il joue dans des pièces de théâtre occasionnellement comme à l’Opéra-Comique ou au Théâtre Français. Dans cet univers, il rencontre Béatrix Dussane, sociétaire de la Comédie française. Il l’épouse en 1911.<br>Journaliste pour Comoedia puis La Liberté, il est employé au Journal en 1912. Cette année va être décisive pour le jeune homme qui se rêve comédien. Il va découvrir le monde du journalisme et la quotidien de reporter de guerre durant la guerre italo-turque dans les Balkans. Cette première expérience à l'étranger marque le début d’une longue collaboration avec le Journal.<br>Deux ans plus tard, la France entre en guerre. Dans les tranchées en France ou sur le front en Macédoine, Edouard Helsey va couvrir la Première guerre mondiale aux quatres coins de l’Europe. A travers ses articles sur le front français en Europe de l’Est, il permet aux lecteurs de découvrir une facette moins connue de celle-ci. “Envoyé spécial” et “éminent collaborateur” deviennent vite des désignations habituelles pour le nommer dans le Journal. Il transforme ses reportages en livres avec diverses publications, à commencer avec Les aventures de l’armée d’Orient en 1920.<br>En 1921, il devient membre de l’agence de presse Havas. L’étendue des déplacements du reporter et des faits historiques qu’il a couvert est impressionnante. Il semble passer de pays en pays avec une facilité déconcertante et parfois même avec des moyens de transport peu imaginables aujourd’hui comme en zepplin (1). Ses enquêtes lui valent d’être décoré de la Légion d’honneur en 1922.<br>Dans la période d’entre-deux guerre, il est le témoin des tensions qui montent entre les nations et des blessures causées par la Première guerre mondiale. Ainsi on peut trouver bon nombre de reportage sur la complexité des relations franco-allemande d’entre deux guerres à travers l’occupation du Rhur par l’armée française en 1923 par exemple (2).  Obsèques de la reine-mère en Angleterre en 1925, reportage sur le kémalisme en Turquie en 1927… A chacun de ses retours en France, Edouard Helsey n’est que de passage. Il préserve un lien avec le début de sa carrière en tant que journaliste en continuant à publier de temps à autres des critiques littéraires et autres chroniques théâtrales dans le Journal.<br>Il réalise par la suite de nombreuses séries de reportage à l’étranger, notamment sur les territoires français du continent africain (3). Tunisie, Niger, Burkina Faso, Côte d’Ivoire...Grâce à sa série “La France sous le soleil”, il traverse l’Afrique pour raconter aux lecteurs son périple mais aussi les situations politiques, sociales ou conflictuelles rencontrées dans les pays visités.<br>Dès lors qu’Adolf Hitler commence à s’imposer en Allemagne, Édouard Helsey se rend à de nombreuses reprises dans ce pays pour écrire plusieurs séries sur le sujet. Il assiste en Allemagne à l’élection d’Hitler, qu’il considère dans un premier temps comme un personnage charismatique pouvant résolument métamorphoser l’Allemagne. Durant la Seconde guerre mondiale, couvre à nouveau de nombreux pays à travers l’Europe toujours pour le Journal.<br>En 1940, il quitte son journal auquel il a été fidèle durant trente années. Il rejoint en 1951 L’Homme libre, pour lequel il réalise notamment plusieurs reportages en Égypte et sur la situation du monde d’après guerre, avec l’apparition de la Guerre froide.<br>La poésie lyrique, le théâtre et la comédie n’ont jamais totalement quitté son esprit. Il continua d’écrire des pièces de théâtre et des alexandrins afin de s’évader de la réalité jusqu’à sa mort en 1966. À l’aube du « journalisme moderne » il apparaît comme un pionnier du genre. Alors que son ami Albert Londres a vu sa carrière honorée par la création d’un prix à son nom en France, Edouard Helsey est aujourd’hui tombé dans l’oubli.<br>Grand reporter, il définit son rôle en tant que tel : « Je ne me connaissais qu’un devoir : voir clair, m’efforcer de faire voir clair ».	[1] Le Journal, 12/09/1919 (https://www.retronews.fr/journal/le-journal/12-septembre-1919/129/221651/1)<br>[2] Le Journal, du 09/01/1923 au 09/03/1923 : https://www.retronews.fr/journal/le-journal/09-janvier-1923/129/244801/1 (Premier de la série)<br>[3] Le Journal, du 26/02/1934 au 11/04/1934 : https://www.retronews.fr/journal/le-journal/26-fevrier-1934/129/112049/1 (Premier de la série)	https://media.gettyimages.com/photos/lucienedmond-marie-coulond-says-edouard-helsey-french-journalist-of-picture-id55756012?s=612x612
Tharaud, Jean et Jérôme	Jean et Jérôme Tharaud : une plume, deux reporters	Pierre Mouny et Augustine Peny	« Notre travail, c’est un bavardage, une conversation continue. Il est absolument impossible de dire que, dans toute notre œuvre, une seule phrase, une seule virgule appartient à Jean ou à Jérôme », voilà comment les frères Tharaud résumaient eux-mêmes leurs œuvres. Ecrivains et journalistes, ils ont fait partie des grands reporters de la première moitié du 20ème siècle.	Jérôme et Jean Tharaud sont deux frères, originaires de Saint-Junien, dans le département de la Haute-Vienne (Limousin). Jérôme est né en 1874 et mort en 1952, son frère est né en 1877 et mort en 1953. Leurs vrais prénoms étaient Ernest et Charles mais l’écrivain et poète Charles Péguy les a renommés Jean et Jérôme, en évocation de l’apôtre Jean et du père de l’Eglise Jérôme.<br>En 1880, à la mort de leur père, ils quittent Saint-Junien avec leur mère, pour s’installer chez leur grand-père, proviseur du lycée d’Angoulème. C’est dans cette ville puis à Paris qu’ils font leurs études. Jérôme intègre l’Ecole normale supérieure dans la section lettre. Jean échoue au concours de Saint-Cyr et à celui de l’inspection des finances. Il se lance alors dans une carrière d’écrivain avec son frère. Leur premier ouvrage intitulé <i>Le Coltineur débile</i>, est publié en 1898. Le livre, qu’ils qualifieront par la suite « d’absurde », imagine une citée future utopiste. Ils écrivent plusieurs récits pour les Cahiers de la Quinzaine (revue bimensuelle fondée par Charles Péguy). En 1906 ils obtiennent le prix Goncourt pour leur ouvrage <i>Dingley, l’illustre écrivain</i>, qui est une critique de l’écrivain britannique Rudyard Kipling et de l’impérialisme anglais. Entre temps, Jérôme est devenu le secrétaire de Maurice Barrès, un des écrivains les plus en vogue à l’époque. Il occupe ce poste jusqu’à la Première Guerre mondiale. Après la guerre, Jérôme et Jean Tharaud vont devenir des journalistes reconnus. Pendant près de cinquante ans, les deux frères ont écrit des centaines d’articles pour différents journaux. Ils ont toujours signé les articles de leurs deux prénoms. Jean, le cadet, se chargeait d’écrire une première version et son grand frère, Jérôme, s’occupait de réviser et de rectifier le texte. Les deux frères ont voyagé dans de nombreux pays, desquels ils ont tiré des reportages pour Le Figaro, L’Echo de Paris, L’Intransigeant et surtout pour Paris Soir. Ils ont notamment visité la Palestine, l’Iran, le Maroc et la Roumanie … Ils ont également couvert le contexte géopolitique particulier de l’entre-deux-guerres, avec des articles décrivant la montée du nazisme depuis les pays de l’Europe de l’Est. Plus tard, leurs écrits seront accusés de complaisance avec l’antisémitisme latent de l’époque. En parallèle des reportages, ils ont aussi rédigé de nombreux livres sur leurs voyages, comme au Maroc, avec des ouvrages renommés comme Marrakech ou les seigneurs de l’Atlas, Rabat ou les Heures marocaines, Fés ou le Bourgeois de l’Islam, La nuit de Fés… Ils reçoivent en 1919, le Grand Prix de littérature de l’Académie française pour l’ensemble de leur œuvre. Séduit par la vallée de la Rance, les deux frères s’installent en 1919, dans le manoir des Affenais dans la commune de Le-Minihic-sur-Rance. Ils ont vécu dans ce manoir jusqu’à la Seconde Guerre mondiale, période pendant laquelle la demeure est occupée par l’armée nazie. Le 1er décembre 1938, Jérôme, qui n’était pourtant que « la moitié d’un couple d’auteurs », est élu au 31e fauteuil de l’Académie française. Jean est finalement élu à son tour en 1946.,	Pas de notes	https://upload.wikimedia.org/wikipedia/commons/thumb/8/88/Fr%C3%A8res_Tharaud_a_Meurisse_1932.jpg/1024px-Fr%C3%A8res_Tharaud_a_Meurisse_1932.jpg
