REPORTER	TITRE	AUTEUR	CHAPO	TEXTE	REF	PHOTO
Leroux, Gaston	Gaston Leroux, le reporter derrière l’écrivain	Alexandre Lepère et Leo Corcos	On connaît surtout Gaston Leroux pour ses écrits de fiction. Mais on sait peu qu’avant d’être romancier, il était journaliste. Une confrontation à la réalité qui a innervé son oeuvre par la suite.	Né à Paris, Gaston Leroux grandit en Normandie, où il obtient un baccalauréat littéraire. Il revient à Paris, en faculté de Droit, en 1886. Il commence comme avocat, mais collabore à diverses revues. Il commence par rédiger pour L’Echo de Paris (janvier 1892), pour arrondir ses fins de mois. Il s’engage, ensuite, avec Le Matin en 1894, où il réalise ses plus célèbres reportages : suivi du procès d’Auguste Vaillant (1894), guerre russo-japonaise (1904-05)... Il y fera l’essentiel de sa carrière, jusqu’en 1907, date à laquelle il retourne à la littérature. Ses oeuvres, telles que Le Mystère de la Chambre Jaune ou Le Fantôme de l’Opéra, paraissent en feuilleton. Il décède le 15 avril 1927, à Nice, quelques semaines après la publication de son ultime roman, Mister Flow.<br>Le 10 janvier 1894, l’anarchiste Auguste Vaillant est condamné à mort après avoir lancé une bombe dans la Chambre des députés. Cette affaire est le premier sujet majeur de la carrière journalistique de Gaston Leroux et marque le début de sa collaboration avec Le Matin. Son tout premier article est un entretien avec le duc d’Orléans, paru le 15 mars 1895.<br>Par la suite, il rédige le suivi de l’affaire Dreyfus, en débutant le 12 janvier 1898.<br>Après avoir publié un premier article sur la Russie le 17 septembre 1898, il devient l’envoyé spécial permanent du Matin dans le pays. Il devient grand reporter en 1901.<br>En 1902, il est nommé chevalier de la Légion d'honneur pour services distingués dans la presse. Dans le Matin, il publie le 5 octobre 1903 le premier de ses 15 romans-feuilletons. C'est un « roman-concours », dont l'objectif est la découverte du trésor du bandit Cartouche.<br>Il suit la guerre russo-japonaise dans son intégralité (8 février 1904 au 5 septembre 1905), de la bataille du port de Chemulpo (07 avril 1904) à la conférence pour la paix de Porstmouth en août 1905. Entre-temps, il conte l’effondrement des tsars (1904-1906), le récit de l’expédition Nordenskjold dans le pôle sud, à partir du 07 janvier 1904. Il mène aussi une vive critique sur l’état de la Seine et les fausses allégations du préfet (exemple : le 13 mars 1904). Il obtiendra un blâme du conseil municipal contre l’administration des eaux (article du 22 mars 1904).<br>Son année 1904 se termine au Maroc (du 25 au 31 décembre), suite à la décision du sultan de renvoyer les employés européens. Puis, Gaston Leroux revient à la Russie et commence le 15 mars sa série d’articles intitulée : “L”agonie de la Russie Blanche”. Il la termine le 17 février 1906. Parmi ses derniers déplacements, citons celui au Vatican, le 22 avril 1906 ou en Algérie, auprès des exilés français, le 10 juillet 1906.<br>En froid avec le directeur du Matin, il s’écarte, en avril 1907, du journal qui l’a employé, en tant que reporter, presque toute sa vie durant. Le 31 août 1907, il effectue son ultime reportage pour le Matin à Berlin en y vantant le succès des voitures du journal, engagées dans la course Paris-Pékin. Puis il revient à la littérature, mais le journalisme, qui lui a permis de commenter nombre de situations du quotidien, fournit sa production littéraire.<br>En 1907 paraît Le Mystère de la chambre jaune, qui conte les « Aventures extraordinaires du reporter Joseph Joséphin dit Boitabille », devenu Rouletabille après protestation d’un homonyme. Les aventures de son détective paraissent néanmoins en feuilleton, dans Le Matin ou L’Illustration, par exemple.<br>Son roman le plus connu, « Le Fantôme de l’Opéra », paraît en février 1910. Il marque l’apogée de sa carrière, et établit un syncrétisme entre son expérience de journaliste, sa connaissance du terrain, et ses qualités d’écriture.<br>En juillet 1914, il s’apprête à publier son quatrième feuilleton sur Rouletabille (Le plus grand mystère du monde), mais la guerre l’en empêche.	Pas de notes	https://upload.wikimedia.org/wikipedia/commons/8/8a/G._LEROUX.jpg
Condroyer, Emile	Titre ?	Xavier Ponroy et Aurélia Valarié	Chapô ?	"Emile Condroyer, né en 1897 à Sainte-Maxime et mort en 1950 à Villejuif, est un journaliste et écrivain français. Enfant, il rêve de devenir marin et de quitter sa Provence natale pour explorer la Méditerranée. Un rêve brisé par la Première guerre mondiale, à laquelle il participe en tant que chasseur alpin. Une expérience traumatisante dont il revient grièvement blessé et qui, comme le souligne un article retraçant son parcours publié dans Le Journal le 2 novembre 1933,  « changea comme pour tant d'autres sa destinée ».<br>Après un début à la rédaction de « L'Intransigeant » (quotidien du soir plutôt classé à droite dans les années 1920), il devient collaborateur pour « Le Journal » en 1923. Emile Condroyer mêle sa passion pour la littérature et la poésie à son domaine de prédilection. C'est en tant qu’ « envoyé spécial » qu'il parcourt les mers du globe, souvent à bord d'embarcations françaises. L'occasion pour lui de rester en contact avec ce monde à qui il dédiait des vers étant adolescent.<br>Ses plus grands reportages portent sur la marine française, le travail des matelots et des pêcheurs, ou encore sur la vie des gardiens de phare. Il traverse avec eux la Méditerranée, l’Océan Atlantique, la Manche, avec pour objectif de faire connaitre leur quotidien. La plupart de ces articles sont reconnus pour leur force poétique et leur pouvoir d'évocation.<br>Dans une série de reportages, Emile Condroyer rend hommage aux ingénieurs, sauveteurs et gardiens de phare dont l'activité est d’assurer la sécurité de la navigation à la pointe de Bretagne (île de Sein, d’Ouessant, de Molène…). Ces rencontres et ces histoires bouleversantes amèneront à la publication en 1929 d'un recueil des articles du reporter, intitulé Les hommes dans la tempête.  Une étape incontournable, comme il l'explique dans l'ouvrage : « la littérature ne se donne pas de gants pour interpréter la vie des gardiens de phares… Forte des droits de l'imagination, elle réorganise tout à sa manière ».<br>Ce recueil lui vaudra le Prix Albert Londres en 1933 ; ce qui fait de lui le premier à avoir reçu cette distinction. Dédiée « à M. Fernand Crouton, bâtisseur de phares », cette enquête, veut redonner aux gardiens de phare la place qu’ils méritent selon le Provençal. Mais c'est aussi une ode à ces bâtiments qui guident les marins dans la pénombre. Pour Émile Condroyer, le phare est « seul comme le génie », possède « l'harmonie d'une architecture parfaite et la rigueur d'un chiffre », dissipe « l'équivoque mortelle des nuits en mer », il est « l'étincelle d'intelligence précise qui brille dans le désordre de la nature. »<br>Dans un autre de ses reportages célèbres, Une campagne de pêche au large de l’Islande, Emile Condroyer s’immerge au sein d’un chalutier breton sur les eaux islandaises entre l’Entre-deux-guerres. Il y suit la vie des morutiers et y décrit la pénibilité de leur travail, souvent méconnu des terriens. En plus de décrire leur quotidien,  le journaliste s’interroge dans ses articles sur leur place dans un monde en mouvement, et le regard qu’ils portent sur leur propre statut. Les propos recueillis sont sans équivoques : « De sûr que ce n’est pas un métier. À terre, les gens ne savent pas ce que c'est qu'un marin. Personne ne s'occupe de nous, vu qu'on n'est jamais là pour voter. Tenez, dans le dictionnaire, y a : « Marin. Homme employé à la conduite des navires ». Et voilà, on a tout dit. »<br>S'intéressant à tout ce qui a trait à « la Grande Bleue », Émile Condroyer a également couvert plusieurs fois des fêtes maritimes, à Saint-Malo ou en Angleterre. Son expertise dans le domaine lui vaudra de devenir « correspondant de guerre maritime » du Journal du début de la Seconde Guerre Mondiale à l’invasion allemande. Il continuera ensuite d’écrire en zone libre, mais toujours au bord de mer, devenant l’un des envoyés spéciaux en Provence et sur la Côte d’Azur.<br>Ses écrits sur la mer sont des références, mais le reporter s'est également penché sur des sujets nationaux plus « terriens ». Ses reportages sur le Couvent de la Trappe, rassemblés dans La maison du grand silence (1928), lui valent de nombreux hommages. Journaliste de l'entre-deux-guerres, il est aussi un témoin des soubresauts historiques et politiques de son époque. De  l’Islande à la Pologne, en passant par le Maghreb, l’Espagne, ou encore l’Italie, Émile Condroyer se fait l'écho d'une tension internationale. Ce passionné d'histoire (Regards sur le passé de Nantes, 1945) prenait également un grand plaisir à faire découvrir aux lecteurs des monuments historiques. Il était aussi un spécialiste des questions sociales et militaires. Il a notamment couvert de nombreuses commémorations ou fêtes nationales.<br>Référence journalistique des années trente, les enquêtes d'Émile Condroyer restent encore des modèles aujourd’hui, de part leurs sujets, leurs traitements et leurs formes quasi-romanesque."	Pas de notes	Pas d'image.
Faure-Favier, Louise	Louise Faure-Favier, journaliste et aviatrice	Auteur•e ?	Louise Faure-Favier est plus connue pour ses records en aviation que pour ses articles. Pourtant, elle a été l’une des premières Françaises à exercer le métier de journaliste. Biographie d’une aventurière féministe.	Son milieu d’origine et sa formation ne sont pas connus. En 1906, Louise Faure-Favier fonde avec son mari, Jean Ernest-Charles, la revue Le Censeur Politique et Littéraire [2]. C’est en écrivant pour ce journal qu’elle se fait repérer. Elle devient amie avec Guillaume Apollinaire, Marie Laurencin, Max Jacob, Pablo Picasso... Elle écrit en 1910 quelques petits articles sur les femmes dans Gil Blas. Sa principale passion est l’aviation. En juin 1919, Louise Faure-Favier effectue en deux heures le trajet Paris-Bruxelles[3] à bord du « Goliath ». Deux mois plus tard, elle prend part à l’équipe qui rejoint Paris à Casablanca [4] en 16 heures. Avec son ami Lucien Bossoutrot, elle effectue la même année le vol Paris-Dakar et bat le record de vitesse. Louise Faure-Favier raconte tous ses voyages et ses impressions de bord à différents journaux. Elle travaille d’abord pour Le Siècle, puis Le Figaro et les Annales politiques et littéraires, ainsi qu’au Temps. Louise Faure-Favier écrit de façon ponctuelle, sur son sujet de prédilection. Elle écrit ses impressions de bord, mais aussi des reportages sur le thème de l’aviation. Elle livre au Figaro en 1920 un portrait de son ami, le pilote Lucien Bossoutrot[5]. Elle choisit également de couvrir l’apprentissage des aviateurs débutants[6], ou des pratiques insolites telles que le golf aérien[7]. Louise Faure-Favier consacre ses articles au thème de l’aviation : les progrès faits, les manifestations organisées, les personnes importantes de ce milieu, etc. Lorsqu’elle écrit sur un autre sujet, c’est le plus souvent pour parler des personnes ou des endroits qu’elle a rencontrés au cours de ses voyages aériens. En 1924, elle commence notamment une série d’articles intitulée « Les Européennes » pour Les Annales politiques et littéraires. Louise Faure-Favier écrit sur des personnes rencontrées en Roumanie[8], Tchécoslovaquie [9], ou encore en Yougoslavie [10]. En 1921, la jeune aviatrice est chargée par le sous-secrétariat d’Etat à l’aéronautique d’écrire les horaires d’aviation, les « indicateurs aériens » [11]. Elle est également chargée la même année de développer les premiers guides officiels aériens, à destination des aviateurs civils. [12] En 1933, elle participe en tant que radio-reporter au Tour de France aérien.[13] Louise Faure-Favier est également une écrivaine. Parmi ses œuvres les plus (re)connues : Ces choses qui seront vieilles (1919), Mademoiselle loin du Ciel (1920), Les chevaliers de l’air (1922), Blanche et Noir (1928), Souvenirs sur Guillaume Apollinaire (1945). Ses romans, comme ses reportages, abordent la question de l’aviation civile française, ainsi que la place des femmes dans la société. Dès 1902, le journal Gil Blas la qualifie de « femme d’esprit »[14]. Dans le journal Paris-Soir du 16 août 1924, le journaliste Arnold Bontemps écrit que Louise Faure-Favier est « un écrivain subtil »[15]. Il met en avant ses records d’aviation impressionnants et la qualité de ses reportages. En 1927, Le Figaro publie quelques pages du roman « Mon oncle nègre » et écrit que Louise Faure-Favier possède « la sensibilité et l’extraordinaire don de vie qui caractérisent [son] talent ».[16] Louise Faure-Favier obtient le Prix de l’Académie française en 1942.[17] Elle meurt en 1961.	Pas de notes	Pas d'image.
Anet, Claude	Claude Anet, romancier et reporter	Sarah Saadi-Garcia	Claude Anet, de son vrai nom Jean Schopfer était un écrivain à succès pendant la période de l‘entre-deux-guerres et un homme dont la vie fut rythmée par les voyages, les rencontres et les récits.	"Né à Morges (Suisse) en 1868 d’une famille française et protestante, il obtient sans difficulté la nationalité française assez jeune et s’installe à Paris pour ses études. Il fait tout d’abord une licence de lettres à la Sorbonne puis suit une formation en histoire de l’art à l’Ecole du Louvre. Ses études le conduisent presque naturellement vers la Revue Blanche, revue d’art avant-gardiste de la fin du XIXe siècle, où il devient critique d’art en 1893 et signe encore de son vrai nom, Jean Schopfer.  Même s’il rédige plusieurs critiques, l’écriture n’est pas sa principale activité : sportif, et très bon en tennis il remporte en 1892 le tournoi de Roland-Garros et en est finaliste en 1893 [1].<br>A la fin du XIXe siècle, il signe ses écrits avec un nouvel alias, Claude Anet, rival historique de Jean-Jacques Rousseau, tous deux amoureux de Françoise-Louise de Warens (dans les Confessions). Il indique ainsi son penchant pour les histoires d’amour complexes, et les adultères, quasi-présents dans chacun de ses romans et qui lui valent d’être souvent qualifié d’écrivain « immoral ».En 1920, après qu’il ait publié Ariane, un roman traitant d’une jeune fille russe qui vit une histoire d‘amour avec un homme marié, la Revue des Lectures décrit alors l’écrivain comme un « reporter et chroniqueur, marchant de bibelots et tapisseries, romancier, dramaturge ; laisse nombre d’œuvres qui sont, pour la plupart, complètement immorales », illustrant une époque où les valeurs du mariage sont encore bien ancrées dans la société française. (Il a également été accusé d’immoralité lors de la publication de La rive d’Asie, amour et harem en 1927 parce qu’il évoque la polygamie, pratique acceptée en Turquie où le roman se déroule).<br>Malgré ces critiques, il a connu un grand succès en tant que romancier, et a publié une vingtaine de romans dont deux ont été adaptés au cinéma : Ariane, jeune fille russe avec Audrey Burn en tête d’affiche et Mayerling avec Catherine Deneuve.<br>Claude Anet était un grand voyageur, attiré par l’Orient et plus largement l’Asie (il a d’ailleurs un rapport orientaliste à la Turquie et la Perse). Polyglotte, il maîtrise l’anglais, l’allemand, le russe et le persan (en 1924, il publie Feuilles persanes, un recueil de chroniques qu’il traduit en collaboration avec Mirza Muhammad).<br>Il devient peu à peu reporter et commence à l’être pour le Temps et le Petit Parisien où il devient célèbre.  En juillet 1917, il est envoyé par le journal à Petrograd (Saint-Pétersbourg) où il couvre la révolution bolchévique. C’est grâce à ce travail d’envoyé spécial qu’il est reconnu. Le quotidien qui l’emploie n’est pas vraiment favorable à cette révolution, et n’est en général pas un journal de gauche. Il marque donc son angoisse vis-à-vis de cette situation et craint l’abandon possible de la Russie dans la première guerre mondiale : « Nous reprenons aujourd’hui la publication, que nous avons dû interrompre pendant quelques jours, des notes passionnantes prises d’heure en heure, pour ainsi dire, par notre envoyé spécial en Russie, M. Claude Anet. On y trouve la trace des inquiétudes que nous avons éprouvées et que l’auteur, étant sur place, devait éprouver plus que nous encore, au spectacle d’attitudes, de décisions, d’événements qui pouvaient faire douter du concours militaire à venir de la Russie. »[2] Cette révolution est dépeinte de manière assez sombre par Claude Anet, avec un ton romancier propre à l’auteur.<br>Ses chroniques connaissent un grand succès et sont si importantes pour le pouvoir français que Clémenceau le convoque dès son retour en France pour connaître l’évolution de la situation en détails. En 1921, il publie Quand la terre trembla, et y transpose nombre de ses chroniques russes de manière romanesque. Il relate la vie des russes et ses changements au fur et à mesure que l’influence des bolchéviques grandit. Avec ce roman, il assume son statut particulier de “romancier-journaliste” qui est déjà fréquent à cette époque (Joseph Kessel, Emile Zola...).<br>Claude Anet meurt à 62 ans, le 9 janvier 1931 à Paris d’une septicémie généralisée. Il a marqué le monde littéraire avec ses critiques d‘art et ses romans orientalistes qui ont parfois fait scandale mais aussi la presse française avec des reportages à la fois romancés et très détaillés.	[1] Il précise d’ailleurs l’importance qu’il donne au sport dans la construction de son identité littéraire. « Avant d’entrer dans la liste de mes livres, il faut dire que, tout en aimant la philosophie, les lettres et les arts, je faisais du sport. C’était alors, une grande nouveauté en France et je crois bien que j’étais le seul étudiant de la Sorbonne qui pensât que la vie saine du corps eût sa valeur. Je jouais au lawn-tennis et j’eus le grand plaisir de gagner le championnat de France en 1892. » (Passionné par ce sport, il rédige en 1927, un ouvrage sur Suzanne Lenglen, elle aussi star du tennis français.)<br>[2] Extrait – Le Petit Parisien, 13 juin 1917, p. 1.	https://gallica.bnf.fr/ark:/12148/btv1b85308494/f1.highres
Danan, Alexis	Alexis Danan, entre journalisme et militantisme	Astrid Bergère	Alexis Danan est un journaliste français connu pour ses enquêtes sur les enfants "martyrs". Ses articles ont permis de faire avancer la cause de la protection des enfants. Il se comparaît lui-même au Don Quichotte de Cervantès, à la fois militant, reporter, aventurier et poète.	Né en 1890 à Guelma, en Algérie française, Alexis Danan est un journaliste militant. Fils d’un imprimeur juif dans l'atelier duquel il découvre les plaisirs de la poésie et de l’écriture, il est aussi marqué par l’antisémitisme et l'injustice. À seulement 16 ans, il devient rédacteur-en-chef du « Petit Guelma » le journal de sa ville, dans lequel il écrit des chroniques judiciaires.<br>En 1926, son fils meurt à 5 ans à la suite d’une diphtérie mal soignée. C’est un tournant dans sa vie qu'il décide de consacrer à la cause de l'enfance malheureuse. Après un grand reportage remarqué au bagne de Cayenne, dix ans après Albert Londres, et un autre à Belle-Île dans Paris-Soir, il mène plusieurs enquêtes sur l'incurie des institutions médicale et judiciaire en matière de protection de l'enfance. Ses enquêtes lui permet de toucher un public large et il n'hésite pas à intervenir lui-même dans ses reportages, par exemple en soustrayant des enfants à la garde de leurs parents abusifs et en les ramenant à Paris, sous le regard des photographes du journal. Trois ans après son entrée dans à Paris-Soir, il publie « La Mauvaise graine », à la suite de laquelle il lance un appel à la réforme des institutions pour mineurs de l’Administration pénitentiaire. Le 28 février 1935, son enquête sur « Les enfants du taudis » est publiée à la Une de Paris-Soir, un des quotidiens les plus lu du moment. Dans cet article, il dénonce la mauvaise volonté de l’État d’aider les familles et de leur donner un logement décent, ainsi éviter la propagation de la tuberculose. Il s’oppose également au placement d’enfants assistés chez des familles d’accueil, souvent sans possibilité de les récupérer « L’état, trop pauvre pour construire, ou pour dégrever la construction, est assez riche pour pourvoir à l’entretien de faux orphelins qui lui coûtent, chacun, jusqu’à leur majorité, 40,000 francs », écrit-il.<br>En 1944, Alexis Danan rejoint la rédaction du journal Libération fondé en 1941 par des résistants. Il sera choisi pour couvrir les procès de Nuremberg. À la fin de l’année 1948, il rejoint la rédaction d’un autre journal créé par des résistants : Franc Tireur. C’est un contexte de guerre froide et de division, pendant lequel il publie des reportages sur les enfants juifs et sur la guerre en général. Néanmoins, il n’abandonne pas ses combats pour les enfants qu'il poursuit dans des associations et en lançant des revues.<br>Tout au long de sa vie, il a été accusé de faire de la démagogie et de jouer de l’indignation et de l’émotion. Il meurt en 1979, à l’âge de 89 ans.	Combats pour l’enfance : itinéraire d’un faiseur d’opinion, Alexis Danan (1890 – 1979 ), Pascale Quincy-Lefebvre 2014.<br>Portrait d’Alexis Danan, Enfants en justice.<br>Fédération des comités Alexis Danan, Pour la protection de l’enfance.<br>« Alexis Danan, l’outré à outrance », Libération, 10 septembre 2014.	https://encrypted-tbn0.gstatic.com/images?q=tbn:ANd9GcRtJxDUM4Uxe2x9TddVOO_n62kxcGeUygq1iw&usqp=CAU
